{
  "topic_id": "topic_01J9Y4H8J9",
  "working_title": "   ",
  "audience": "   ",
  "primary_goal": "Book a database audit call",
  "funnel_stage": "consideration",
  "core_message": "Schema-valid (minLength 1 is satisfied by whitespace) but operationally unusable.",
  "supporting_points": [
    "A real point",
    "   "
  ],
  "cta": "Book your audit",
  "keywords": [],
  "brand_voice": "confident-direct",
  "status": "approved",
  "created_date": "2026-07-29T09:00:00Z",
  "updated_date": "2026-07-29T09:00:00Z",
  "version": 1,
  "schema_version": "1.0",
  "source": "manual",
  "backlog_reference_id": null,
  "content_pillar": null,
  "tags": [],
  "priority": null,
  "related_topic_ids": [],
  "locale": "en",
  "owner": "chris@digitallyconnected.net",
  "notes": "working_title/audience are whitespace-only strings — pass schema minLength:1 but must fail the operational usable-content check."
}
